root@comp3134-winter2023:~# tcpdump -n -i eth0
tcpdump: verbose output suppressed, use -v or -vv for full protocol decode
listening on eth0, link-type EN10MB (Ethernet), capture size 262144 bytes
03:48:53.824192 IP 68.183.206.171.22 > 99.245.237.99.55005: Flags [P.], seq 4042115094:4042115202, ack 1707711919, win 501, length 108
03:48:53.824275 IP 68.183.206.171.22 > 99.245.237.99.55005: Flags [P.], seq 108:144, ack 1, win 501, length 36
03:48:53.824319 IP 68.183.206.171.22 > 99.245.237.99.55005: Flags [P.], seq 144:252, ack 1, win 501, length 108
03:48:53.824355 IP 68.183.206.171.22 > 99.245.237.99.55005: Flags [P.], seq 252:288, ack 1, win 501, length 36
03:48:53.824477 IP 68.183.206.171.22 > 99.245.237.99.55005: Flags [P.], seq 288:460, ack 1, win 501, length 172
03:48:53.824516 IP 68.183.206.171.22 > 99.245.237.99.55005: Flags [P.], seq 460:496, ack 1, win 501, length 36
03:48:53.824560 IP 68.183.206.171.22 > 99.245.237.99.55005: Flags [P.], seq 496:644, ack 1, win 501, length 148
03:48:53.824597 IP 68.183.206.171.22 > 99.245.237.99.55005: Flags [P.], seq 644:680, ack 1, win 501, length 36
03:48:53.824638 IP 68.183.206.171.22 > 99.245.237.99.55005: Flags [P.], seq 680:828, ack 1, win 501, length 148
03:48:53.847769 IP 99.245.237.99.55005 > 68.183.206.171.22: Flags [.], ack 108, win 510, length 0
03:48:53.847770 IP 99.245.237.99.55005 > 68.183.206.171.22: Flags [.], ack 252, win 509, length 0
03:48:53.847770 IP 99.245.237.99.55005 > 68.183.206.171.22: Flags [.], ack 460, win 508, length 0
03:48:53.847770 IP 99.245.237.99.55005 > 68.183.206.171.22: Flags [.], ack 644, win 507, length 0
03:48:53.847770 IP 99.245.237.99.55005 > 68.183.206.171.22: Flags [.], ack 828, win 513, length 0
03:48:53.847851 IP 68.183.206.171.22 > 99.245.237.99.55005: Flags [P.], seq 828:1968, ack 1, win 501, length 1140
03:48:53.848073 IP 68.183.206.171.22 > 99.245.237.99.55005: Flags [P.], seq 1968:2612, ack 1, win 501, length 644
03:48:53.848139 IP 68.183.206.171.22 > 99.245.237.99.55005: Flags [P.], seq 2612:2768, ack 1, win 501, length 156
03:48:53.848199 IP 68.183.206.171.22 > 99.245.237.99.55005: Flags [P.], seq 2768:2924, ack 1, win 501, length 156
03:48:53.848259 IP 68.183.206.171.22 > 99.245.237.99.55005: Flags [P.], seq 2924:3080, ack 1, win 501, length 156
03:48:53.848317 IP 68.183.206.171.22 > 99.245.237.99.55005: Flags [P.], seq 3080:3236, ack 1, win 501, length 156
03:48:53.848361 IP 68.183.206.171.22 > 99.245.237.99.55005: Flags [P.], seq 3236:3392, ack 1, win 501, length 156
03:48:53.848401 IP 68.183.206.171.22 > 99.245.237.99.55005: Flags [P.], seq 3392:3548, ack 1, win 501, length 156
03:48:53.848450 IP 68.183.206.171.22 > 99.245.237.99.55005: Flags [P.], seq 3548:3704, ack 1, win 501, length 156
03:48:53.848491 IP 68.183.206.171.22 > 99.245.237.99.55005: Flags [P.], seq 3704:3860, ack 1, win 501, length 156
03:48:53.848528 IP 68.183.206.171.22 > 99.245.237.99.55005: Flags [P.], seq 3860:4016, ack 1, win 501, length 156
03:48:53.848564 IP 68.183.206.171.22 > 99.245.237.99.55005: Flags [P.], seq 4016:4172, ack 1, win 501, length 156
03:48:53.848599 IP 68.183.206.171.22 > 99.245.237.99.55005: Flags [P.], seq 4172:4328, ack 1, win 501, length 156
03:48:53.848634 IP 68.183.206.171.22 > 99.245.237.99.55005: Flags [P.], seq 4328:4484, ack 1, win 501, length 156
03:48:53.848677 IP 68.183.206.171.22 > 99.245.237.99.55005: Flags [P.], seq 4484:4640, ack 1, win 501, length 156
03:48:53.848727 IP 68.183.206.171.22 > 99.245.237.99.55005: Flags [P.], seq 4640:4796, ack 1, win 501, length 156
03:48:53.848776 IP 68.183.206.171.22 > 99.245.237.99.55005: Flags [P.], seq 4796:4952, ack 1, win 501, length 156
03:48:53.848824 IP 68.183.206.171.22 > 99.245.237.99.55005: Flags [P.], seq 4952:5108, ack 1, win 501, length 156
03:48:53.848874 IP 68.183.206.171.22 > 99.245.237.99.55005: Flags [P.], seq 5108:5264, ack 1, win 501, length 156
03:48:53.848914 IP 68.183.206.171.22 > 99.245.237.99.55005: Flags [P.], seq 5264:5420, ack 1, win 501, length 156
03:48:53.870526 IP 99.245.237.99.55005 > 68.183.206.171.22: Flags [.], ack 2612, win 513, length 0
03:48:53.870608 IP 68.183.206.171.22 > 99.245.237.99.55005: Flags [P.], seq 5420:5576, ack 1, win 501, length 156
03:48:53.870790 IP 68.183.206.171.22 > 99.245.237.99.55005: Flags [P.], seq 5576:5708, ack 1, win 501, length 132
03:48:53.870837 IP 68.183.206.171.22 > 99.245.237.99.55005: Flags [P.], seq 5708:5744, ack 1, win 501, length 36
03:48:53.870885 IP 68.183.206.171.22 > 99.245.237.99.55005: Flags [P.], seq 5744:5892, ack 1, win 501, length 148
03:48:53.875211 IP 99.245.237.99.55005 > 68.183.206.171.22: Flags [.], ack 2924, win 512, length 0
03:48:53.875211 IP 99.245.237.99.55005 > 68.183.206.171.22: Flags [.], ack 3236, win 510, length 0
03:48:53.875211 IP 99.245.237.99.55005 > 68.183.206.171.22: Flags [.], ack 3548, win 509, length 0
03:48:53.875211 IP 99.245.237.99.55005 > 68.183.206.171.22: Flags [.], ack 3860, win 508, length 0
03:48:53.875212 IP 99.245.237.99.55005 > 68.183.206.171.22: Flags [.], ack 4172, win 513, length 0
03:48:53.875212 IP 99.245.237.99.55005 > 68.183.206.171.22: Flags [.], ack 4484, win 512, length 0
03:48:53.875212 IP 99.245.237.99.55005 > 68.183.206.171.22: Flags [.], ack 4796, win 510, length 0
03:48:53.875212 IP 99.245.237.99.55005 > 68.183.206.171.22: Flags [.], ack 5108, win 509, length 0
03:48:53.875302 IP 68.183.206.171.22 > 99.245.237.99.55005: Flags [P.], seq 5892:6480, ack 1, win 501, length 588
03:48:53.875436 IP 99.245.237.99.55005 > 68.183.206.171.22: Flags [.], ack 5420, win 508, length 0
03:48:53.875630 IP 68.183.206.171.22 > 99.245.237.99.55005: Flags [P.], seq 6480:6612, ack 1, win 501, length 132
03:48:53.875697 IP 68.183.206.171.22 > 99.245.237.99.55005: Flags [P.], seq 6612:6648, ack 1, win 501, length 36
03:48:53.875743 IP 68.183.206.171.22 > 99.245.237.99.55005: Flags [P.], seq 6648:6780, ack 1, win 501, length 132
03:48:53.875813 IP 68.183.206.171.22 > 99.245.237.99.55005: Flags [P.], seq 6780:6948, ack 1, win 501, length 168
03:48:53.875853 IP 68.183.206.171.22 > 99.245.237.99.55005: Flags [P.], seq 6948:6984, ack 1, win 501, length 36
03:48:53.875898 IP 68.183.206.171.22 > 99.245.237.99.55005: Flags [P.], seq 6984:7116, ack 1, win 501, length 132
03:48:53.875946 IP 68.183.206.171.22 > 99.245.237.99.55005: Flags [P.], seq 7116:7152, ack 1, win 501, length 36
03:48:53.875981 IP 68.183.206.171.22 > 99.245.237.99.55005: Flags [P.], seq 7152:7284, ack 1, win 501, length 132
03:48:53.876018 IP 68.183.206.171.22 > 99.245.237.99.55005: Flags [P.], seq 7284:7320, ack 1, win 501, length 36
03:48:53.876060 IP 68.183.206.171.22 > 99.245.237.99.55005: Flags [P.], seq 7320:7452, ack 1, win 501, length 132
03:48:53.876096 IP 68.183.206.171.22 > 99.245.237.99.55005: Flags [P.], seq 7452:7488, ack 1, win 501, length 36
03:48:53.876138 IP 68.183.206.171.22 > 99.245.237.99.55005: Flags [P.], seq 7488:7620, ack 1, win 501, length 132
03:48:53.876176 IP 68.183.206.171.22 > 99.245.237.99.55005: Flags [P.], seq 7620:7656, ack 1, win 501, length 36
03:48:53.876219 IP 68.183.206.171.22 > 99.245.237.99.55005: Flags [P.], seq 7656:7788, ack 1, win 501, length 132
03:48:53.876255 IP 68.183.206.171.22 > 99.245.237.99.55005: Flags [P.], seq 7788:7824, ack 1, win 501, length 36
03:48:53.876299 IP 68.183.206.171.22 > 99.245.237.99.55005: Flags [P.], seq 7824:7972, ack 1, win 501, length 148
03:48:53.876334 IP 68.183.206.171.22 > 99.245.237.99.55005: Flags [P.], seq 7972:8008, ack 1, win 501, length 36
03:48:53.876377 IP 68.183.206.171.22 > 99.245.237.99.55005: Flags [P.], seq 8008:8140, ack 1, win 501, length 132
03:48:53.876413 IP 68.183.206.171.22 > 99.245.237.99.55005: Flags [P.], seq 8140:8176, ack 1, win 501, length 36
03:48:53.876453 IP 68.183.206.171.22 > 99.245.237.99.55005: Flags [P.], seq 8176:8324, ack 1, win 501, length 148
03:48:53.876487 IP 68.183.206.171.22 > 99.245.237.99.55005: Flags [P.], seq 8324:8360, ack 1, win 501, length 36
03:48:53.876529 IP 68.183.206.171.22 > 99.245.237.99.55005: Flags [P.], seq 8360:8508, ack 1, win 501, length 148
03:48:53.876562 IP 68.183.206.171.22 > 99.245.237.99.55005: Flags [P.], seq 8508:8544, ack 1, win 501, length 36
03:48:53.876604 IP 68.183.206.171.22 > 99.245.237.99.55005: Flags [P.], seq 8544:8692, ack 1, win 501, length 148
03:48:53.876643 IP 68.183.206.171.22 > 99.245.237.99.55005: Flags [P.], seq 8692:8728, ack 1, win 501, length 36
03:48:53.876682 IP 68.183.206.171.22 > 99.245.237.99.55005: Flags [P.], seq 8728:8876, ack 1, win 501, length 148
03:48:53.876733 IP 68.183.206.171.22 > 99.245.237.99.55005: Flags [P.], seq 8876:8912, ack 1, win 501, length 36
03:48:53.876765 IP 68.183.206.171.22 > 99.245.237.99.55005: Flags [P.], seq 8912:9060, ack 1, win 501, length 148
03:48:53.876800 IP 68.183.206.171.22 > 99.245.237.99.55005: Flags [P.], seq 9060:9096, ack 1, win 501, length 36
03:48:53.876840 IP 68.183.206.171.22 > 99.245.237.99.55005: Flags [P.], seq 9096:9244, ack 1, win 501, length 148
03:48:53.876875 IP 68.183.206.171.22 > 99.245.237.99.55005: Flags [P.], seq 9244:9280, ack 1, win 501, length 36
03:48:53.881525 IP 99.245.237.99.55005 > 68.183.206.171.22: Flags [.], ack 5708, win 513, length 0
03:48:53.881598 IP 68.183.206.171.22 > 99.245.237.99.55005: Flags [P.], seq 9280:12200, ack 1, win 501, length 2920
03:48:53.887799 IP 99.245.237.99.55005 > 68.183.206.171.22: Flags [.], ack 5892, win 512, length 0
03:48:53.887867 IP 68.183.206.171.22 > 99.245.237.99.55005: Flags [P.], seq 12200:14240, ack 1, win 501, length 2040
03:48:53.894280 IP 99.245.237.99.55005 > 68.183.206.171.22: Flags [.], ack 6612, win 509, length 0
03:48:53.894280 IP 99.245.237.99.55005 > 68.183.206.171.22: Flags [.], ack 6780, win 509, length 0
03:48:53.894280 IP 99.245.237.99.55005 > 68.183.206.171.22: Flags [.], ack 6984, win 508, length 0
03:48:53.894280 IP 99.245.237.99.55005 > 68.183.206.171.22: Flags [.], ack 7152, win 507, length 0
03:48:53.894280 IP 99.245.237.99.55005 > 68.183.206.171.22: Flags [.], ack 7320, win 513, length 0
03:48:53.894280 IP 99.245.237.99.55005 > 68.183.206.171.22: Flags [.], ack 7488, win 512, length 0
03:48:53.894281 IP 99.245.237.99.55005 > 68.183.206.171.22: Flags [.], ack 7656, win 511, length 0
03:48:53.894281 IP 99.245.237.99.55005 > 68.183.206.171.22: Flags [.], ack 7824, win 511, length 0
03:48:53.894362 IP 68.183.206.171.22 > 99.245.237.99.55005: Flags [P.], seq 14240:14600, ack 1, win 501, length 360
03:48:53.894418 IP 99.245.237.99.55005 > 68.183.206.171.22: Flags [.], ack 8008, win 510, length 0
03:48:53.894418 IP 99.245.237.99.55005 > 68.183.206.171.22: Flags [.], ack 8176, win 509, length 0
03:48:53.894418 IP 99.245.237.99.55005 > 68.183.206.171.22: Flags [.], ack 8360, win 509, length 0
03:48:53.894418 IP 99.245.237.99.55005 > 68.183.206.171.22: Flags [.], ack 8544, win 508, length 0
03:48:53.894418 IP 99.245.237.99.55005 > 68.183.206.171.22: Flags [.], ack 8728, win 507, length 0
03:48:53.894418 IP 99.245.237.99.55005 > 68.183.206.171.22: Flags [.], ack 8912, win 513, length 0
03:48:53.894418 IP 99.245.237.99.55005 > 68.183.206.171.22: Flags [.], ack 9096, win 512, length 0
03:48:53.894418 IP 99.245.237.99.55005 > 68.183.206.171.22: Flags [.], ack 9280, win 511, length 0
03:48:53.894614 IP 68.183.206.171.22 > 99.245.237.99.55005: Flags [P.], seq 14600:14732, ack 1, win 501, length 132
03:48:53.894682 IP 68.183.206.171.22 > 99.245.237.99.55005: Flags [P.], seq 14732:14768, ack 1, win 501, length 36
03:48:53.894707 IP 68.183.206.171.22 > 99.245.237.99.55005: Flags [P.], seq 14768:14900, ack 1, win 501, length 132
03:48:53.894743 IP 68.183.206.171.22 > 99.245.237.99.55005: Flags [P.], seq 14900:14936, ack 1, win 501, length 36
03:48:53.894785 IP 68.183.206.171.22 > 99.245.237.99.55005: Flags [P.], seq 14936:15068, ack 1, win 501, length 132
03:48:53.894822 IP 68.183.206.171.22 > 99.245.237.99.55005: Flags [P.], seq 15068:15104, ack 1, win 501, length 36
03:48:53.894863 IP 68.183.206.171.22 > 99.245.237.99.55005: Flags [P.], seq 15104:15236, ack 1, win 501, length 132
03:48:53.894899 IP 68.183.206.171.22 > 99.245.237.99.55005: Flags [P.], seq 15236:15272, ack 1, win 501, length 36
03:48:53.894943 IP 68.183.206.171.22 > 99.245.237.99.55005: Flags [P.], seq 15272:15404, ack 1, win 501, length 132
03:48:53.895009 IP 68.183.206.171.22 > 99.245.237.99.55005: Flags [P.], seq 15404:15572, ack 1, win 501, length 168
03:48:53.895045 IP 68.183.206.171.22 > 99.245.237.99.55005: Flags [P.], seq 15572:15608, ack 1, win 501, length 36
03:48:53.895084 IP 68.183.206.171.22 > 99.245.237.99.55005: Flags [P.], seq 15608:15740, ack 1, win 501, length 132
03:48:53.895117 IP 68.183.206.171.22 > 99.245.237.99.55005: Flags [P.], seq 15740:15776, ack 1, win 501, length 36
03:48:53.895155 IP 68.183.206.171.22 > 99.245.237.99.55005: Flags [P.], seq 15776:15908, ack 1, win 501, length 132
03:48:53.895242 IP 68.183.206.171.22 > 99.245.237.99.55005: Flags [P.], seq 15908:16136, ack 1, win 501, length 228
03:48:53.895275 IP 68.183.206.171.22 > 99.245.237.99.55005: Flags [P.], seq 16136:16268, ack 1, win 501, length 132
03:48:53.895317 IP 68.183.206.171.22 > 99.245.237.99.55005: Flags [P.], seq 16268:16304, ack 1, win 501, length 36
03:48:53.895355 IP 68.183.206.171.22 > 99.245.237.99.55005: Flags [P.], seq 16304:16436, ack 1, win 501, length 132
03:48:53.895415 IP 68.183.206.171.22 > 99.245.237.99.55005: Flags [P.], seq 16436:16472, ack 1, win 501, length 36
03:48:53.895458 IP 68.183.206.171.22 > 99.245.237.99.55005: Flags [P.], seq 16472:16604, ack 1, win 501, length 132
03:48:53.895494 IP 68.183.206.171.22 > 99.245.237.99.55005: Flags [P.], seq 16604:16640, ack 1, win 501, length 36
03:48:53.895534 IP 68.183.206.171.22 > 99.245.237.99.55005: Flags [P.], seq 16640:16772, ack 1, win 501, length 132
03:48:53.895567 IP 68.183.206.171.22 > 99.245.237.99.55005: Flags [P.], seq 16772:16808, ack 1, win 501, length 36
03:48:53.895606 IP 68.183.206.171.22 > 99.245.237.99.55005: Flags [P.], seq 16808:16940, ack 1, win 501, length 132
03:48:53.895658 IP 68.183.206.171.22 > 99.245.237.99.55005: Flags [P.], seq 16940:16976, ack 1, win 501, length 36
03:48:53.895686 IP 68.183.206.171.22 > 99.245.237.99.55005: Flags [P.], seq 16976:17108, ack 1, win 501, length 132
03:48:53.895723 IP 68.183.206.171.22 > 99.245.237.99.55005: Flags [P.], seq 17108:17144, ack 1, win 501, length 36
03:48:53.895762 IP 68.183.206.171.22 > 99.245.237.99.55005: Flags [P.], seq 17144:17276, ack 1, win 501, length 132
03:48:53.895800 IP 68.183.206.171.22 > 99.245.237.99.55005: Flags [P.], seq 17276:17312, ack 1, win 501, length 36
03:48:53.895842 IP 68.183.206.171.22 > 99.245.237.99.55005: Flags [P.], seq 17312:17444, ack 1, win 501, length 132
03:48:53.895879 IP 68.183.206.171.22 > 99.245.237.99.55005: Flags [P.], seq 17444:17480, ack 1, win 501, length 36
03:48:53.895923 IP 68.183.206.171.22 > 99.245.237.99.55005: Flags [P.], seq 17480:17636, ack 1, win 501, length 156
03:48:53.900416 IP 99.245.237.99.55005 > 68.183.206.171.22: Flags [.], ack 12200, win 513, length 0
03:48:53.900479 IP 68.183.206.171.22 > 99.245.237.99.55005: Flags [P.], seq 17672:20084, ack 1, win 501, length 2412
03:48:53.919130 IP 99.245.237.99.55005 > 68.183.206.171.22: Flags [.], ack 14240, win 513, length 0
03:48:53.919131 IP 99.245.237.99.55005 > 68.183.206.171.22: Flags [.], ack 14732, win 511, length 0
03:48:53.919131 IP 99.245.237.99.55005 > 68.183.206.171.22: Flags [.], ack 14900, win 510, length 0
03:48:53.919131 IP 99.245.237.99.55005 > 68.183.206.171.22: Flags [.], ack 15068, win 510, length 0
03:48:53.919131 IP 99.245.237.99.55005 > 68.183.206.171.22: Flags [.], ack 15236, win 509, length 0
03:48:53.919131 IP 99.245.237.99.55005 > 68.183.206.171.22: Flags [.], ack 15404, win 508, length 0
03:48:53.919131 IP 99.245.237.99.55005 > 68.183.206.171.22: Flags [.], ack 15608, win 507, length 0
03:48:53.919131 IP 99.245.237.99.55005 > 68.183.206.171.22: Flags [.], ack 15776, win 513, length 0
03:48:53.919209 IP 68.183.206.171.22 > 99.245.237.99.55005: Flags [P.], seq 20084:23004, ack 1, win 501, length 2920
03:48:53.919264 IP 99.245.237.99.55005 > 68.183.206.171.22: Flags [.], ack 16136, win 511, length 0
03:48:53.919264 IP 99.245.237.99.55005 > 68.183.206.171.22: Flags [.], ack 16304, win 511, length 0
03:48:53.919264 IP 99.245.237.99.55005 > 68.183.206.171.22: Flags [.], ack 16472, win 510, length 0
03:48:53.919264 IP 99.245.237.99.55005 > 68.183.206.171.22: Flags [.], ack 16640, win 509, length 0
03:48:53.919264 IP 99.245.237.99.55005 > 68.183.206.171.22: Flags [.], ack 16808, win 509, length 0
03:48:53.919264 IP 99.245.237.99.55005 > 68.183.206.171.22: Flags [.], ack 16976, win 508, length 0
03:48:53.919327 IP 68.183.206.171.22 > 99.245.237.99.55005: Flags [P.], seq 23004:23232, ack 1, win 501, length 228
03:48:53.919477 IP 68.183.206.171.22 > 99.245.237.99.55005: Flags [P.], seq 23232:23600, ack 1, win 501, length 368
03:48:53.919520 IP 68.183.206.171.22 > 99.245.237.99.55005: Flags [P.], seq 23600:23740, ack 1, win 501, length 140
03:48:53.919623 IP 68.183.206.171.22 > 99.245.237.99.55005: Flags [P.], seq 23740:24080, ack 1, win 501, length 340
03:48:53.919740 IP 68.183.206.171.22 > 99.245.237.99.55005: Flags [P.], seq 24080:24740, ack 1, win 501, length 660
03:48:53.920050 IP 68.183.206.171.22 > 99.245.237.99.55005: Flags [P.], seq 24740:25872, ack 1, win 501, length 1132
03:48:53.920166 IP 68.183.206.171.22 > 99.245.237.99.55005: Flags [P.], seq 25872:26028, ack 1, win 501, length 156
03:48:53.920262 IP 68.183.206.171.22 > 99.245.237.99.55005: Flags [P.], seq 26028:26184, ack 1, win 501, length 156
03:48:53.920356 IP 68.183.206.171.22 > 99.245.237.99.55005: Flags [P.], seq 26184:26340, ack 1, win 501, length 156
03:48:53.920455 IP 68.183.206.171.22 > 99.245.237.99.55005: Flags [P.], seq 26340:26496, ack 1, win 501, length 156
03:48:53.920531 IP 68.183.206.171.22 > 99.245.237.99.55005: Flags [P.], seq 26496:26652, ack 1, win 501, length 156
03:48:53.920591 IP 68.183.206.171.22 > 99.245.237.99.55005: Flags [P.], seq 26652:26808, ack 1, win 501, length 156
03:48:53.920645 IP 68.183.206.171.22 > 99.245.237.99.55005: Flags [P.], seq 26808:26964, ack 1, win 501, length 156
03:48:53.920699 IP 68.183.206.171.22 > 99.245.237.99.55005: Flags [P.], seq 26964:27120, ack 1, win 501, length 156
03:48:53.920757 IP 68.183.206.171.22 > 99.245.237.99.55005: Flags [P.], seq 27120:27276, ack 1, win 501, length 156
03:48:53.920808 IP 68.183.206.171.22 > 99.245.237.99.55005: Flags [P.], seq 27276:27432, ack 1, win 501, length 156
03:48:53.920992 IP 68.183.206.171.22 > 99.245.237.99.55005: Flags [P.], seq 27432:27588, ack 1, win 501, length 156
03:48:53.921071 IP 68.183.206.171.22 > 99.245.237.99.55005: Flags [P.], seq 27588:27744, ack 1, win 501, length 156
03:48:53.921133 IP 68.183.206.171.22 > 99.245.237.99.55005: Flags [P.], seq 27744:27900, ack 1, win 501, length 156
03:48:53.921192 IP 68.183.206.171.22 > 99.245.237.99.55005: Flags [P.], seq 27900:28056, ack 1, win 501, length 156
03:48:53.921247 IP 68.183.206.171.22 > 99.245.237.99.55005: Flags [P.], seq 28056:28212, ack 1, win 501, length 156
03:48:53.921305 IP 68.183.206.171.22 > 99.245.237.99.55005: Flags [P.], seq 28212:28368, ack 1, win 501, length 156
03:48:53.921365 IP 68.183.206.171.22 > 99.245.237.99.55005: Flags [P.], seq 28368:28524, ack 1, win 501, length 156
03:48:53.921423 IP 68.183.206.171.22 > 99.245.237.99.55005: Flags [P.], seq 28524:28680, ack 1, win 501, length 156
03:48:53.921478 IP 68.183.206.171.22 > 99.245.237.99.55005: Flags [P.], seq 28680:28836, ack 1, win 501, length 156
03:48:53.921534 IP 68.183.206.171.22 > 99.245.237.99.55005: Flags [P.], seq 28836:28992, ack 1, win 501, length 156
03:48:53.923347 IP 99.245.237.99.55005 > 68.183.206.171.22: Flags [.], ack 17144, win 507, length 0
03:48:53.923348 IP 99.245.237.99.55005 > 68.183.206.171.22: Flags [.], ack 17312, win 513, length 0
03:48:53.923348 IP 99.245.237.99.55005 > 68.183.206.171.22: Flags [.], ack 17480, win 512, length 0
03:48:53.923348 IP 99.245.237.99.55005 > 68.183.206.171.22: Flags [.], ack 17672, win 511, length 0
03:48:53.923348 IP 99.245.237.99.55005 > 68.183.206.171.22: Flags [.], ack 20084, win 513, length 0
03:48:53.923594 IP 68.183.206.171.22 > 99.245.237.99.55005: Flags [P.], seq 28992:29148, ack 1, win 501, length 156
03:48:53.923632 IP 68.183.206.171.22 > 99.245.237.99.55005: Flags [P.], seq 29148:29688, ack 1, win 501, length 540
03:48:53.923691 IP 68.183.206.171.22 > 99.245.237.99.55005: Flags [P.], seq 29688:29956, ack 1, win 501, length 268
03:48:53.923854 IP 68.183.206.171.22 > 99.245.237.99.55005: Flags [P.], seq 29956:30112, ack 1, win 501, length 156
03:48:53.923981 IP 68.183.206.171.22 > 99.245.237.99.55005: Flags [P.], seq 30112:30268, ack 1, win 501, length 156
03:48:53.924055 IP 68.183.206.171.22 > 99.245.237.99.55005: Flags [P.], seq 30268:30424, ack 1, win 501, length 156
03:48:53.924126 IP 68.183.206.171.22 > 99.245.237.99.55005: Flags [P.], seq 30424:30580, ack 1, win 501, length 156
03:48:53.924181 IP 68.183.206.171.22 > 99.245.237.99.55005: Flags [P.], seq 30580:30736, ack 1, win 501, length 156
03:48:53.924235 IP 68.183.206.171.22 > 99.245.237.99.55005: Flags [P.], seq 30736:30892, ack 1, win 501, length 156
03:48:53.924294 IP 68.183.206.171.22 > 99.245.237.99.55005: Flags [P.], seq 30892:31048, ack 1, win 501, length 156
03:48:53.924462 IP 68.183.206.171.22 > 99.245.237.99.55005: Flags [P.], seq 31048:31204, ack 1, win 501, length 156
03:48:53.924533 IP 68.183.206.171.22 > 99.245.237.99.55005: Flags [P.], seq 31204:31360, ack 1, win 501, length 156
03:48:53.943483 IP 99.245.237.99.55005 > 68.183.206.171.22: Flags [.], ack 23004, win 513, length 0
03:48:53.943483 IP 99.245.237.99.55005 > 68.183.206.171.22: Flags [.], ack 23600, win 510, length 0
03:48:53.943483 IP 99.245.237.99.55005 > 68.183.206.171.22: Flags [.], ack 24080, win 509, length 0
03:48:53.943483 IP 99.245.237.99.55005 > 68.183.206.171.22: Flags [.], ack 25872, win 513, length 0
03:48:53.943555 IP 68.183.206.171.22 > 99.245.237.99.55005: Flags [P.], seq 31360:31516, ack 1, win 501, length 156
03:48:53.943789 IP 68.183.206.171.22 > 99.245.237.99.55005: Flags [P.], seq 31516:32072, ack 1, win 501, length 556
03:48:53.943854 IP 68.183.206.171.22 > 99.245.237.99.55005: Flags [P.], seq 32072:32228, ack 1, win 501, length 156
03:48:53.943897 IP 68.183.206.171.22 > 99.245.237.99.55005: Flags [P.], seq 32228:32384, ack 1, win 501, length 156
03:48:53.943972 IP 68.183.206.171.22 > 99.245.237.99.55005: Flags [P.], seq 32384:32540, ack 1, win 501, length 156
03:48:53.944028 IP 68.183.206.171.22 > 99.245.237.99.55005: Flags [P.], seq 32540:32696, ack 1, win 501, length 156
03:48:53.944098 IP 68.183.206.171.22 > 99.245.237.99.55005: Flags [P.], seq 32696:32852, ack 1, win 501, length 156
03:48:53.944173 IP 68.183.206.171.22 > 99.245.237.99.55005: Flags [P.], seq 32852:33008, ack 1, win 501, length 156
03:48:53.950412 IP 99.245.237.99.55005 > 68.183.206.171.22: Flags [.], ack 26184, win 512, length 0
03:48:53.950412 IP 99.245.237.99.55005 > 68.183.206.171.22: Flags [.], ack 26496, win 510, length 0
03:48:53.950412 IP 99.245.237.99.55005 > 68.183.206.171.22: Flags [.], ack 26808, win 509, length 0
03:48:53.950412 IP 99.245.237.99.55005 > 68.183.206.171.22: Flags [.], ack 27120, win 508, length 0
03:48:53.950412 IP 99.245.237.99.55005 > 68.183.206.171.22: Flags [.], ack 27432, win 513, length 0
03:48:53.950412 IP 99.245.237.99.55005 > 68.183.206.171.22: Flags [.], ack 27744, win 512, length 0
03:48:53.950413 IP 99.245.237.99.55005 > 68.183.206.171.22: Flags [.], ack 28524, win 509, length 0
03:48:53.950413 IP 99.245.237.99.55005 > 68.183.206.171.22: Flags [.], ack 28680, win 508, length 0
03:48:53.950516 IP 68.183.206.171.22 > 99.245.237.99.55005: Flags [P.], seq 33008:33164, ack 1, win 501, length 156
03:48:53.950558 IP 99.245.237.99.55005 > 68.183.206.171.22: Flags [.], ack 28992, win 513, length 0
03:48:53.950559 IP 99.245.237.99.55005 > 68.183.206.171.22: Flags [.], ack 29688, win 510, length 0
03:48:53.950559 IP 99.245.237.99.55005 > 68.183.206.171.22: Flags [.], ack 30112, win 508, length 0
03:48:53.950559 IP 99.245.237.99.55005 > 68.183.206.171.22: Flags [.], ack 30424, win 507, length 0
03:48:53.950559 IP 99.245.237.99.55005 > 68.183.206.171.22: Flags [.], ack 30736, win 513, length 0
03:48:53.950559 IP 99.245.237.99.55005 > 68.183.206.171.22: Flags [.], ack 31048, win 512, length 0
03:48:53.950559 IP 99.245.237.99.55005 > 68.183.206.171.22: Flags [.], ack 31360, win 510, length 0
03:48:53.950908 IP 68.183.206.171.22 > 99.245.237.99.55005: Flags [P.], seq 33164:34832, ack 1, win 501, length 1668
03:48:53.950987 IP 68.183.206.171.22 > 99.245.237.99.55005: Flags [P.], seq 34832:34988, ack 1, win 501, length 156
03:48:53.951104 IP 68.183.206.171.22 > 99.245.237.99.55005: Flags [P.], seq 34988:35144, ack 1, win 501, length 156
03:48:53.951240 IP 68.183.206.171.22 > 99.245.237.99.55005: Flags [P.], seq 35144:35300, ack 1, win 501, length 156
03:48:53.951298 IP 68.183.206.171.22 > 99.245.237.99.55005: Flags [P.], seq 35300:35456, ack 1, win 501, length 156
03:48:53.951338 IP 68.183.206.171.22 > 99.245.237.99.55005: Flags [P.], seq 35456:35612, ack 1, win 501, length 156
03:48:53.951389 IP 68.183.206.171.22 > 99.245.237.99.55005: Flags [P.], seq 35612:35768, ack 1, win 501, length 156
03:48:53.951428 IP 68.183.206.171.22 > 99.245.237.99.55005: Flags [P.], seq 35768:35924, ack 1, win 501, length 156
03:48:53.951480 IP 68.183.206.171.22 > 99.245.237.99.55005: Flags [P.], seq 35924:36080, ack 1, win 501, length 156
03:48:53.951564 IP 68.183.206.171.22 > 99.245.237.99.55005: Flags [P.], seq 36080:36236, ack 1, win 501, length 156
03:48:53.951605 IP 68.183.206.171.22 > 99.245.237.99.55005: Flags [P.], seq 36236:36392, ack 1, win 501, length 156
03:48:53.951660 IP 68.183.206.171.22 > 99.245.237.99.55005: Flags [P.], seq 36392:36548, ack 1, win 501, length 156
03:48:53.951710 IP 68.183.206.171.22 > 99.245.237.99.55005: Flags [P.], seq 36548:36704, ack 1, win 501, length 156
03:48:53.951769 IP 68.183.206.171.22 > 99.245.237.99.55005: Flags [P.], seq 36704:36860, ack 1, win 501, length 156
03:48:53.951823 IP 68.183.206.171.22 > 99.245.237.99.55005: Flags [P.], seq 36860:37016, ack 1, win 501, length 156
03:48:53.951895 IP 68.183.206.171.22 > 99.245.237.99.55005: Flags [P.], seq 37016:37172, ack 1, win 501, length 156
03:48:53.951951 IP 68.183.206.171.22 > 99.245.237.99.55005: Flags [P.], seq 37172:37328, ack 1, win 501, length 156
03:48:53.952008 IP 68.183.206.171.22 > 99.245.237.99.55005: Flags [P.], seq 37328:37484, ack 1, win 501, length 156
03:48:53.952066 IP 68.183.206.171.22 > 99.245.237.99.55005: Flags [P.], seq 37484:37640, ack 1, win 501, length 156
^C
240 packets captured
245 packets received by filter
1 packet dropped by kernel
root@comp3134-winter2023:~#
