root@comp3134-winter2023:~# tcpdump -i eth0
tcpdump: verbose output suppressed, use -v or -vv for full protocol decode
listening on eth0, link-type EN10MB (Ethernet), capture size 262144 bytes
03:39:30.776573 IP comp3134-winter2023.ssh > cpeac202e742173-cmac202e742170.sdns.net.rogers.com.51690: Flags [P.], seq 3569845618:3569845726, ack 1759884400, win 501, length 108
03:39:30.776674 IP comp3134-winter2023.ssh > cpeac202e742173-cmac202e742170.sdns.net.rogers.com.51690: Flags [P.], seq 108:144, ack 1, win 501, length 36
03:39:30.776700 IP comp3134-winter2023.ssh > cpeac202e742173-cmac202e742170.sdns.net.rogers.com.51690: Flags [P.], seq 144:252, ack 1, win 501, length 108
03:39:30.776735 IP comp3134-winter2023.ssh > cpeac202e742173-cmac202e742170.sdns.net.rogers.com.51690: Flags [P.], seq 252:288, ack 1, win 501, length 36
03:39:30.778419 IP comp3134-winter2023.37668 > 67.207.67.2.domain: 52658+ [1au] PTR? 99.237.245.99.in-addr.arpa. (55)
03:39:30.778500 IP comp3134-winter2023.50689 > 67.207.67.2.domain: 8893+ [1au] PTR? 99.237.245.99.in-addr.arpa. (55)
03:39:30.778562 IP comp3134-winter2023.45184 > 67.207.67.2.domain: 20659+ [1au] PTR? 99.237.245.99.in-addr.arpa. (55)
03:39:30.786305 IP 67.207.67.2.domain > comp3134-winter2023.37668: 52658 1/0/1 PTR cpeac202e742173-cmac202e742170.sdns.net.rogers.com. (119)
03:39:30.787042 IP comp3134-winter2023.59258 > 67.207.67.2.domain: 47145+ [1au] PTR? 171.206.183.68.in-addr.arpa. (56)
03:39:30.787193 IP comp3134-winter2023.57863 > 67.207.67.2.domain: 32198+ [1au] PTR? 171.206.183.68.in-addr.arpa. (56)
03:39:30.787247 IP comp3134-winter2023.58435 > 67.207.67.2.domain: 26676+ [1au] PTR? 171.206.183.68.in-addr.arpa. (56)
03:39:30.790697 IP 67.207.67.2.domain > comp3134-winter2023.50689: 8893 1/0/1 PTR cpeac202e742173-cmac202e742170.sdns.net.rogers.com. (119)
03:39:30.790698 IP 67.207.67.2.domain > comp3134-winter2023.45184: 20659 1/0/1 PTR cpeac202e742173-cmac202e742170.sdns.net.rogers.com. (119)
03:39:30.790698 IP cpeac202e742173-cmac202e742170.sdns.net.rogers.com.51690 > comp3134-winter2023.ssh: Flags [.], ack 108, win 510, length 0
03:39:30.790698 IP cpeac202e742173-cmac202e742170.sdns.net.rogers.com.51690 > comp3134-winter2023.ssh: Flags [.], ack 252, win 509, length 0
03:39:30.790757 IP comp3134-winter2023 > 67.207.67.2: ICMP comp3134-winter2023 udp port 50689 unreachable, length 155
03:39:30.790780 IP comp3134-winter2023 > 67.207.67.2: ICMP comp3134-winter2023 udp port 45184 unreachable, length 155
03:39:30.821053 IP 67.207.67.2.domain > comp3134-winter2023.57863: 32198 NXDomain 0/1/1 (123)
03:39:30.821246 IP comp3134-winter2023.57863 > 67.207.67.2.domain: 32198+ PTR? 171.206.183.68.in-addr.arpa. (45)
03:39:30.824452 IP 67.207.67.2.domain > comp3134-winter2023.58435: 26676 NXDomain 0/1/1 (123)
03:39:30.824618 IP comp3134-winter2023.58435 > 67.207.67.2.domain: 26676+ PTR? 171.206.183.68.in-addr.arpa. (45)
03:39:30.825602 IP 67.207.67.2.domain > comp3134-winter2023.58435: 26676 NXDomain 0/1/0 (112)
03:39:30.851757 IP 67.207.67.2.domain > comp3134-winter2023.59258: 47145 NXDomain 0/1/1 (123)
03:39:30.851844 IP 67.207.67.2.domain > comp3134-winter2023.57863: 32198 NXDomain 0/1/0 (112)
03:39:30.852099 IP comp3134-winter2023.59258 > 67.207.67.2.domain: 47145+ PTR? 171.206.183.68.in-addr.arpa. (45)
03:39:30.853141 IP 67.207.67.2.domain > comp3134-winter2023.59258: 47145 NXDomain 0/1/0 (112)
03:39:30.853753 IP comp3134-winter2023.ssh > cpeac202e742173-cmac202e742170.sdns.net.rogers.com.51690: Flags [P.], seq 288:500, ack 1, win 501, length 212
03:39:30.853910 IP comp3134-winter2023.ssh > cpeac202e742173-cmac202e742170.sdns.net.rogers.com.51690: Flags [P.], seq 500:536, ack 1, win 501, length 36
03:39:30.854016 IP comp3134-winter2023.ssh > cpeac202e742173-cmac202e742170.sdns.net.rogers.com.51690: Flags [P.], seq 536:724, ack 1, win 501, length 188
03:39:30.854100 IP comp3134-winter2023.ssh > cpeac202e742173-cmac202e742170.sdns.net.rogers.com.51690: Flags [P.], seq 724:760, ack 1, win 501, length 36
03:39:30.854194 IP comp3134-winter2023.ssh > cpeac202e742173-cmac202e742170.sdns.net.rogers.com.51690: Flags [P.], seq 760:948, ack 1, win 501, length 188
03:39:30.854279 IP comp3134-winter2023.ssh > cpeac202e742173-cmac202e742170.sdns.net.rogers.com.51690: Flags [P.], seq 948:984, ack 1, win 501, length 36
03:39:30.854361 IP comp3134-winter2023.ssh > cpeac202e742173-cmac202e742170.sdns.net.rogers.com.51690: Flags [P.], seq 984:1172, ack 1, win 501, length 188
03:39:30.854444 IP comp3134-winter2023.ssh > cpeac202e742173-cmac202e742170.sdns.net.rogers.com.51690: Flags [P.], seq 1172:1208, ack 1, win 501, length 36
03:39:30.855445 IP comp3134-winter2023.54751 > 67.207.67.2.domain: 35308+ [1au] PTR? 2.67.207.67.in-addr.arpa. (53)
03:39:30.855592 IP comp3134-winter2023.47334 > 67.207.67.2.domain: 9894+ [1au] PTR? 2.67.207.67.in-addr.arpa. (53)
03:39:30.937704 IP comp3134-winter2023.ssh > cpeac202e742173-cmac202e742170.sdns.net.rogers.com.51690: Flags [P.], seq 1400:1556, ack 1, win 501, length 156
03:39:30.937828 IP comp3134-winter2023.ssh > cpeac202e742173-cmac202e742170.sdns.net.rogers.com.51690: Flags [P.], seq 1592:1748, ack 1, win 501, length 156
03:39:30.937914 IP comp3134-winter2023.ssh > cpeac202e742173-cmac202e742170.sdns.net.rogers.com.51690: Flags [P.], seq 1784:1964, ack 1, win 501, length 180
03:39:30.938039 IP comp3134-winter2023.ssh > cpeac202e742173-cmac202e742170.sdns.net.rogers.com.51690: Flags [P.], seq 2000:2156, ack 1, win 501, length 156
03:39:30.938188 IP comp3134-winter2023.ssh > cpeac202e742173-cmac202e742170.sdns.net.rogers.com.51690: Flags [P.], seq 2192:2348, ack 1, win 501, length 156
03:39:30.938333 IP comp3134-winter2023.ssh > cpeac202e742173-cmac202e742170.sdns.net.rogers.com.51690: Flags [P.], seq 2384:2540, ack 1, win 501, length 156
03:39:30.938393 IP comp3134-winter2023.ssh > cpeac202e742173-cmac202e742170.sdns.net.rogers.com.51690: Flags [P.], seq 2540:2576, ack 1, win 501, length 36
03:39:30.938576 IP comp3134-winter2023.ssh > cpeac202e742173-cmac202e742170.sdns.net.rogers.com.51690: Flags [P.], seq 2756:3404, ack 1, win 501, length 648
03:39:30.938613 IP comp3134-winter2023.ssh > cpeac202e742173-cmac202e742170.sdns.net.rogers.com.51690: Flags [P.], seq 3404:3440, ack 1, win 501, length 36
03:39:30.948171 IP cpeac202e742173-cmac202e742170.sdns.net.rogers.com.51690 > comp3134-winter2023.ssh: Flags [.], ack 1364, win 511, length 0
03:39:30.948171 IP cpeac202e742173-cmac202e742170.sdns.net.rogers.com.51690 > comp3134-winter2023.ssh: Flags [.], ack 1556, win 510, length 0
03:39:30.948172 IP cpeac202e742173-cmac202e742170.sdns.net.rogers.com.51690 > comp3134-winter2023.ssh: Flags [.], ack 1748, win 510, length 0
03:39:30.948172 IP cpeac202e742173-cmac202e742170.sdns.net.rogers.com.51690 > comp3134-winter2023.ssh: Flags [.], ack 1964, win 509, length 0
03:39:30.948172 IP cpeac202e742173-cmac202e742170.sdns.net.rogers.com.51690 > comp3134-winter2023.ssh: Flags [.], ack 2156, win 508, length 0
03:39:30.948172 IP cpeac202e742173-cmac202e742170.sdns.net.rogers.com.51690 > comp3134-winter2023.ssh: Flags [.], ack 2348, win 507, length 0
03:39:30.948172 IP cpeac202e742173-cmac202e742170.sdns.net.rogers.com.51690 > comp3134-winter2023.ssh: Flags [.], ack 2540, win 513, length 0
03:39:30.948172 IP cpeac202e742173-cmac202e742170.sdns.net.rogers.com.51690 > comp3134-winter2023.ssh: Flags [.], ack 2756, win 512, length 0
03:39:30.948249 IP comp3134-winter2023.ssh > cpeac202e742173-cmac202e742170.sdns.net.rogers.com.51690: Flags [P.], seq 3440:6360, ack 1, win 501, length 2920
03:39:30.948272 IP comp3134-winter2023.ssh > cpeac202e742173-cmac202e742170.sdns.net.rogers.com.51690: Flags [P.], seq 6360:9280, ack 1, win 501, length 2920
03:39:30.948309 IP cpeac202e742173-cmac202e742170.sdns.net.rogers.com.51690 > comp3134-winter2023.ssh: Flags [.], ack 3440, win 509, length 0
03:39:30.948309 IP cpeac202e742173-cmac202e742170.sdns.net.rogers.com.51690 > comp3134-winter2023.ssh: Flags [P.], seq 1:37, ack 3440, win 509, length 36
03:39:30.948355 IP comp3134-winter2023.ssh > cpeac202e742173-cmac202e742170.sdns.net.rogers.com.51690: Flags [P.], seq 9280:9656, ack 37, win 501, length 376
03:39:30.948532 IP comp3134-winter2023.ssh > cpeac202e742173-cmac202e742170.sdns.net.rogers.com.51690: Flags [P.], seq 9656:9836, ack 37, win 501, length 180
03:39:30.948590 IP comp3134-winter2023.ssh > cpeac202e742173-cmac202e742170.sdns.net.rogers.com.51690: Flags [P.], seq 9836:9872, ack 37, win 501, length 36
03:39:30.948636 IP comp3134-winter2023.ssh > cpeac202e742173-cmac202e742170.sdns.net.rogers.com.51690: Flags [P.], seq 9872:10052, ack 37, win 501, length 180
03:39:30.948673 IP comp3134-winter2023.ssh > cpeac202e742173-cmac202e742170.sdns.net.rogers.com.51690: Flags [P.], seq 10052:10088, ack 37, win 501, length 36
03:39:30.948713 IP comp3134-winter2023.ssh > cpeac202e742173-cmac202e742170.sdns.net.rogers.com.51690: Flags [P.], seq 10088:10268, ack 37, win 501, length 180
03:39:30.948757 IP comp3134-winter2023.ssh > cpeac202e742173-cmac202e742170.sdns.net.rogers.com.51690: Flags [P.], seq 10268:10304, ack 37, win 501, length 36
03:39:30.948795 IP comp3134-winter2023.ssh > cpeac202e742173-cmac202e742170.sdns.net.rogers.com.51690: Flags [P.], seq 10304:10484, ack 37, win 501, length 180
03:39:30.948829 IP comp3134-winter2023.ssh > cpeac202e742173-cmac202e742170.sdns.net.rogers.com.51690: Flags [P.], seq 10484:10520, ack 37, win 501, length 36
03:39:30.948870 IP comp3134-winter2023.ssh > cpeac202e742173-cmac202e742170.sdns.net.rogers.com.51690: Flags [P.], seq 10520:10700, ack 37, win 501, length 180
03:39:30.948937 IP comp3134-winter2023.ssh > cpeac202e742173-cmac202e742170.sdns.net.rogers.com.51690: Flags [P.], seq 10700:10916, ack 37, win 501, length 216
03:39:30.948973 IP comp3134-winter2023.ssh > cpeac202e742173-cmac202e742170.sdns.net.rogers.com.51690: Flags [P.], seq 10916:10952, ack 37, win 501, length 36
03:39:30.949016 IP comp3134-winter2023.ssh > cpeac202e742173-cmac202e742170.sdns.net.rogers.com.51690: Flags [P.], seq 10952:11132, ack 37, win 501, length 180
03:39:30.949052 IP comp3134-winter2023.ssh > cpeac202e742173-cmac202e742170.sdns.net.rogers.com.51690: Flags [P.], seq 11132:11168, ack 37, win 501, length 36
03:39:30.949093 IP comp3134-winter2023.ssh > cpeac202e742173-cmac202e742170.sdns.net.rogers.com.51690: Flags [P.], seq 11168:11348, ack 37, win 501, length 180
03:39:30.949128 IP comp3134-winter2023.ssh > cpeac202e742173-cmac202e742170.sdns.net.rogers.com.51690: Flags [P.], seq 11348:11384, ack 37, win 501, length 36
03:39:30.949172 IP comp3134-winter2023.ssh > cpeac202e742173-cmac202e742170.sdns.net.rogers.com.51690: Flags [P.], seq 11384:11580, ack 37, win 501, length 196
03:39:30.949207 IP comp3134-winter2023.ssh > cpeac202e742173-cmac202e742170.sdns.net.rogers.com.51690: Flags [P.], seq 11580:11616, ack 37, win 501, length 36
03:39:30.949250 IP comp3134-winter2023.ssh > cpeac202e742173-cmac202e742170.sdns.net.rogers.com.51690: Flags [P.], seq 11616:11812, ack 37, win 501, length 196
03:39:30.949287 IP comp3134-winter2023.ssh > cpeac202e742173-cmac202e742170.sdns.net.rogers.com.51690: Flags [P.], seq 11812:11848, ack 37, win 501, length 36
03:39:30.949331 IP comp3134-winter2023.ssh > cpeac202e742173-cmac202e742170.sdns.net.rogers.com.51690: Flags [P.], seq 11848:12028, ack 37, win 501, length 180
03:39:30.949364 IP comp3134-winter2023.ssh > cpeac202e742173-cmac202e742170.sdns.net.rogers.com.51690: Flags [P.], seq 12028:12064, ack 37, win 501, length 36
03:39:30.949406 IP comp3134-winter2023.ssh > cpeac202e742173-cmac202e742170.sdns.net.rogers.com.51690: Flags [P.], seq 12064:12252, ack 37, win 501, length 188
03:39:30.949466 IP comp3134-winter2023.ssh > cpeac202e742173-cmac202e742170.sdns.net.rogers.com.51690: Flags [P.], seq 12252:12484, ack 37, win 501, length 232
03:39:30.949502 IP comp3134-winter2023.ssh > cpeac202e742173-cmac202e742170.sdns.net.rogers.com.51690: Flags [P.], seq 12484:12520, ack 37, win 501, length 36
03:39:30.949606 IP comp3134-winter2023.ssh > cpeac202e742173-cmac202e742170.sdns.net.rogers.com.51690: Flags [P.], seq 12520:12716, ack 37, win 501, length 196
03:39:30.949650 IP comp3134-winter2023.ssh > cpeac202e742173-cmac202e742170.sdns.net.rogers.com.51690: Flags [P.], seq 12716:12752, ack 37, win 501, length 36
03:39:30.949695 IP comp3134-winter2023.ssh > cpeac202e742173-cmac202e742170.sdns.net.rogers.com.51690: Flags [P.], seq 12752:12948, ack 37, win 501, length 196
03:39:30.949734 IP comp3134-winter2023.ssh > cpeac202e742173-cmac202e742170.sdns.net.rogers.com.51690: Flags [P.], seq 12948:12984, ack 37, win 501, length 36
03:39:30.949777 IP comp3134-winter2023.ssh > cpeac202e742173-cmac202e742170.sdns.net.rogers.com.51690: Flags [P.], seq 12984:13180, ack 37, win 501, length 196
03:39:30.970219 IP cpeac202e742173-cmac202e742170.sdns.net.rogers.com.51690 > comp3134-winter2023.ssh: Flags [.], ack 9280, win 513, length 0
03:39:30.970219 IP cpeac202e742173-cmac202e742170.sdns.net.rogers.com.51690 > comp3134-winter2023.ssh: Flags [.], ack 9836, win 511, length 0
03:39:30.970281 IP comp3134-winter2023.ssh > cpeac202e742173-cmac202e742170.sdns.net.rogers.com.51690: Flags [P.], seq 13180:16100, ack 37, win 501, length 2920
03:39:30.970305 IP comp3134-winter2023.ssh > cpeac202e742173-cmac202e742170.sdns.net.rogers.com.51690: Flags [P.], seq 16100:19020, ack 37, win 501, length 2920
03:39:30.970377 IP comp3134-winter2023.ssh > cpeac202e742173-cmac202e742170.sdns.net.rogers.com.51690: Flags [P.], seq 19020:19248, ack 37, win 501, length 228
03:39:30.970525 IP comp3134-winter2023.ssh > cpeac202e742173-cmac202e742170.sdns.net.rogers.com.51690: Flags [P.], seq 19248:19428, ack 37, win 501, length 180
03:39:30.977650 IP cpeac202e742173-cmac202e742170.sdns.net.rogers.com.51690 > comp3134-winter2023.ssh: Flags [.], ack 10052, win 510, length 0
03:39:30.977650 IP cpeac202e742173-cmac202e742170.sdns.net.rogers.com.51690 > comp3134-winter2023.ssh: Flags [.], ack 10268, win 509, length 0
03:39:30.977650 IP cpeac202e742173-cmac202e742170.sdns.net.rogers.com.51690 > comp3134-winter2023.ssh: Flags [.], ack 10484, win 508, length 0
03:39:30.977650 IP cpeac202e742173-cmac202e742170.sdns.net.rogers.com.51690 > comp3134-winter2023.ssh: Flags [.], ack 10700, win 507, length 0
03:39:30.977650 IP cpeac202e742173-cmac202e742170.sdns.net.rogers.com.51690 > comp3134-winter2023.ssh: Flags [.], ack 10952, win 513, length 0
03:39:30.977650 IP cpeac202e742173-cmac202e742170.sdns.net.rogers.com.51690 > comp3134-winter2023.ssh: Flags [.], ack 11168, win 512, length 0
03:39:30.977650 IP cpeac202e742173-cmac202e742170.sdns.net.rogers.com.51690 > comp3134-winter2023.ssh: Flags [.], ack 11384, win 511, length 0
03:39:30.977650 IP cpeac202e742173-cmac202e742170.sdns.net.rogers.com.51690 > comp3134-winter2023.ssh: Flags [.], ack 11616, win 510, length 0
03:39:30.977727 IP comp3134-winter2023.ssh > cpeac202e742173-cmac202e742170.sdns.net.rogers.com.51690: Flags [P.], seq 19428:20608, ack 37, win 501, length 1180
03:39:30.977794 IP cpeac202e742173-cmac202e742170.sdns.net.rogers.com.51690 > comp3134-winter2023.ssh: Flags [.], ack 11848, win 509, length 0
03:39:30.977794 IP cpeac202e742173-cmac202e742170.sdns.net.rogers.com.51690 > comp3134-winter2023.ssh: Flags [.], ack 12064, win 508, length 0
03:39:30.977795 IP cpeac202e742173-cmac202e742170.sdns.net.rogers.com.51690 > comp3134-winter2023.ssh: Flags [.], ack 12484, win 513, length 0
03:39:30.977795 IP cpeac202e742173-cmac202e742170.sdns.net.rogers.com.51690 > comp3134-winter2023.ssh: Flags [.], ack 12716, win 512, length 0
03:39:30.977795 IP cpeac202e742173-cmac202e742170.sdns.net.rogers.com.51690 > comp3134-winter2023.ssh: Flags [.], ack 12948, win 511, length 0
03:39:30.977795 IP cpeac202e742173-cmac202e742170.sdns.net.rogers.com.51690 > comp3134-winter2023.ssh: Flags [.], ack 13180, win 510, length 0
03:39:30.977982 IP comp3134-winter2023.ssh > cpeac202e742173-cmac202e742170.sdns.net.rogers.com.51690: Flags [P.], seq 20608:20788, ack 37, win 501, length 180
03:39:30.978081 IP comp3134-winter2023.ssh > cpeac202e742173-cmac202e742170.sdns.net.rogers.com.51690: Flags [P.], seq 20788:20824, ack 37, win 501, length 36
03:39:30.978153 IP comp3134-winter2023.ssh > cpeac202e742173-cmac202e742170.sdns.net.rogers.com.51690: Flags [P.], seq 20824:21004, ack 37, win 501, length 180
03:39:30.978207 IP comp3134-winter2023.ssh > cpeac202e742173-cmac202e742170.sdns.net.rogers.com.51690: Flags [P.], seq 21004:21040, ack 37, win 501, length 36
03:39:30.978263 IP comp3134-winter2023.ssh > cpeac202e742173-cmac202e742170.sdns.net.rogers.com.51690: Flags [P.], seq 21040:21220, ack 37, win 501, length 180
03:39:30.978317 IP comp3134-winter2023.ssh > cpeac202e742173-cmac202e742170.sdns.net.rogers.com.51690: Flags [P.], seq 21220:21256, ack 37, win 501, length 36
03:39:30.978357 IP comp3134-winter2023.ssh > cpeac202e742173-cmac202e742170.sdns.net.rogers.com.51690: Flags [P.], seq 21256:21436, ack 37, win 501, length 180
03:39:30.978395 IP comp3134-winter2023.ssh > cpeac202e742173-cmac202e742170.sdns.net.rogers.com.51690: Flags [P.], seq 21436:21472, ack 37, win 501, length 36
03:39:30.978430 IP comp3134-winter2023.ssh > cpeac202e742173-cmac202e742170.sdns.net.rogers.com.51690: Flags [P.], seq 21472:21652, ack 37, win 501, length 180
03:39:30.978463 IP comp3134-winter2023.ssh > cpeac202e742173-cmac202e742170.sdns.net.rogers.com.51690: Flags [P.], seq 21652:21688, ack 37, win 501, length 36
03:39:30.978499 IP comp3134-winter2023.ssh > cpeac202e742173-cmac202e742170.sdns.net.rogers.com.51690: Flags [P.], seq 21688:21868, ack 37, win 501, length 180
03:39:30.978530 IP comp3134-winter2023.ssh > cpeac202e742173-cmac202e742170.sdns.net.rogers.com.51690: Flags [P.], seq 21868:21904, ack 37, win 501, length 36
03:39:30.978563 IP comp3134-winter2023.ssh > cpeac202e742173-cmac202e742170.sdns.net.rogers.com.51690: Flags [P.], seq 21904:22084, ack 37, win 501, length 180
03:39:30.978616 IP comp3134-winter2023.ssh > cpeac202e742173-cmac202e742170.sdns.net.rogers.com.51690: Flags [P.], seq 22084:22300, ack 37, win 501, length 216
03:39:30.978749 IP comp3134-winter2023.ssh > cpeac202e742173-cmac202e742170.sdns.net.rogers.com.51690: Flags [P.], seq 22300:22964, ack 37, win 501, length 664
03:39:30.978781 IP comp3134-winter2023.ssh > cpeac202e742173-cmac202e742170.sdns.net.rogers.com.51690: Flags [P.], seq 22964:23000, ack 37, win 501, length 36
03:39:30.978983 IP comp3134-winter2023.ssh > cpeac202e742173-cmac202e742170.sdns.net.rogers.com.51690: Flags [P.], seq 23000:23180, ack 37, win 501, length 180
03:39:30.979046 IP comp3134-winter2023.ssh > cpeac202e742173-cmac202e742170.sdns.net.rogers.com.51690: Flags [P.], seq 23180:23216, ack 37, win 501, length 36
03:39:30.979109 IP comp3134-winter2023.ssh > cpeac202e742173-cmac202e742170.sdns.net.rogers.com.51690: Flags [P.], seq 23216:23396, ack 37, win 501, length 180
03:39:30.979169 IP comp3134-winter2023.ssh > cpeac202e742173-cmac202e742170.sdns.net.rogers.com.51690: Flags [P.], seq 23396:23432, ack 37, win 501, length 36
03:39:30.979230 IP comp3134-winter2023.ssh > cpeac202e742173-cmac202e742170.sdns.net.rogers.com.51690: Flags [P.], seq 23432:23612, ack 37, win 501, length 180
03:39:30.979290 IP comp3134-winter2023.ssh > cpeac202e742173-cmac202e742170.sdns.net.rogers.com.51690: Flags [P.], seq 23612:23648, ack 37, win 501, length 36
03:39:30.979327 IP comp3134-winter2023.ssh > cpeac202e742173-cmac202e742170.sdns.net.rogers.com.51690: Flags [P.], seq 23648:23828, ack 37, win 501, length 180
03:39:30.979373 IP comp3134-winter2023.ssh > cpeac202e742173-cmac202e742170.sdns.net.rogers.com.51690: Flags [P.], seq 23828:23864, ack 37, win 501, length 36
03:39:30.979423 IP comp3134-winter2023.ssh > cpeac202e742173-cmac202e742170.sdns.net.rogers.com.51690: Flags [P.], seq 23864:24060, ack 37, win 501, length 196
03:39:30.979486 IP comp3134-winter2023.ssh > cpeac202e742173-cmac202e742170.sdns.net.rogers.com.51690: Flags [P.], seq 24060:24096, ack 37, win 501, length 36
03:39:30.979550 IP comp3134-winter2023.ssh > cpeac202e742173-cmac202e742170.sdns.net.rogers.com.51690: Flags [P.], seq 24096:24292, ack 37, win 501, length 196
03:39:30.979610 IP comp3134-winter2023.ssh > cpeac202e742173-cmac202e742170.sdns.net.rogers.com.51690: Flags [P.], seq 24292:24328, ack 37, win 501, length 36
03:39:30.984084 IP cpeac202e742173-cmac202e742170.sdns.net.rogers.com.51690 > comp3134-winter2023.ssh: Flags [.], ack 19020, win 513, length 0
03:39:30.984085 IP cpeac202e742173-cmac202e742170.sdns.net.rogers.com.51690 > comp3134-winter2023.ssh: Flags [.], ack 19428, win 511, length 0
03:39:30.984155 IP comp3134-winter2023.ssh > cpeac202e742173-cmac202e742170.sdns.net.rogers.com.51690: Flags [P.], seq 24328:27248, ack 37, win 501, length 2920
03:39:30.984176 IP comp3134-winter2023.ssh > cpeac202e742173-cmac202e742170.sdns.net.rogers.com.51690: Flags [P.], seq 27248:29044, ack 37, win 501, length 1796
03:39:30.984334 IP comp3134-winter2023.ssh > cpeac202e742173-cmac202e742170.sdns.net.rogers.com.51690: Flags [P.], seq 29044:29224, ack 37, win 501, length 180
03:39:30.984380 IP comp3134-winter2023.ssh > cpeac202e742173-cmac202e742170.sdns.net.rogers.com.51690: Flags [P.], seq 29224:29260, ack 37, win 501, length 36
03:39:30.984427 IP comp3134-winter2023.ssh > cpeac202e742173-cmac202e742170.sdns.net.rogers.com.51690: Flags [P.], seq 29260:29440, ack 37, win 501, length 180
03:39:30.999318 IP cpeac202e742173-cmac202e742170.sdns.net.rogers.com.51690 > comp3134-winter2023.ssh: Flags [.], ack 20788, win 513, length 0
03:39:30.999438 IP comp3134-winter2023.ssh > cpeac202e742173-cmac202e742170.sdns.net.rogers.com.51690: Flags [P.], seq 29440:30392, ack 37, win 501, length 952
03:39:30.999541 IP cpeac202e742173-cmac202e742170.sdns.net.rogers.com.51690 > comp3134-winter2023.ssh: Flags [.], ack 21004, win 512, length 0
03:39:30.999541 IP cpeac202e742173-cmac202e742170.sdns.net.rogers.com.51690 > comp3134-winter2023.ssh: Flags [.], ack 21220, win 511, length 0
03:39:30.999542 IP cpeac202e742173-cmac202e742170.sdns.net.rogers.com.51690 > comp3134-winter2023.ssh: Flags [.], ack 21436, win 510, length 0
03:39:30.999542 IP cpeac202e742173-cmac202e742170.sdns.net.rogers.com.51690 > comp3134-winter2023.ssh: Flags [.], ack 21652, win 509, length 0
03:39:30.999542 IP cpeac202e742173-cmac202e742170.sdns.net.rogers.com.51690 > comp3134-winter2023.ssh: Flags [.], ack 21868, win 509, length 0
03:39:30.999542 IP cpeac202e742173-cmac202e742170.sdns.net.rogers.com.51690 > comp3134-winter2023.ssh: Flags [.], ack 22084, win 508, length 0
03:39:30.999542 IP cpeac202e742173-cmac202e742170.sdns.net.rogers.com.51690 > comp3134-winter2023.ssh: Flags [.], ack 22964, win 513, length 0
03:39:30.999542 IP cpeac202e742173-cmac202e742170.sdns.net.rogers.com.51690 > comp3134-winter2023.ssh: Flags [.], ack 23180, win 512, length 0
03:39:30.999593 IP cpeac202e742173-cmac202e742170.sdns.net.rogers.com.51690 > comp3134-winter2023.ssh: Flags [.], ack 23396, win 511, length 0
03:39:30.999593 IP cpeac202e742173-cmac202e742170.sdns.net.rogers.com.51690 > comp3134-winter2023.ssh: Flags [.], ack 23612, win 510, length 0
03:39:30.999593 IP cpeac202e742173-cmac202e742170.sdns.net.rogers.com.51690 > comp3134-winter2023.ssh: Flags [.], ack 23828, win 509, length 0
03:39:30.999593 IP cpeac202e742173-cmac202e742170.sdns.net.rogers.com.51690 > comp3134-winter2023.ssh: Flags [.], ack 24060, win 509, length 0
03:39:30.999593 IP cpeac202e742173-cmac202e742170.sdns.net.rogers.com.51690 > comp3134-winter2023.ssh: Flags [.], ack 24292, win 508, length 0
03:39:30.999593 IP cpeac202e742173-cmac202e742170.sdns.net.rogers.com.51690 > comp3134-winter2023.ssh: Flags [.], ack 28708, win 513, length 0
03:39:30.999774 IP comp3134-winter2023.ssh > cpeac202e742173-cmac202e742170.sdns.net.rogers.com.51690: Flags [P.], seq 30392:30572, ack 37, win 501, length 180
03:39:31.000023 IP comp3134-winter2023.ssh > cpeac202e742173-cmac202e742170.sdns.net.rogers.com.51690: Flags [P.], seq 30572:32208, ack 37, win 501, length 1636
03:39:31.000153 IP comp3134-winter2023.ssh > cpeac202e742173-cmac202e742170.sdns.net.rogers.com.51690: Flags [P.], seq 32208:33148, ack 37, win 501, length 940
03:39:31.000435 IP comp3134-winter2023.ssh > cpeac202e742173-cmac202e742170.sdns.net.rogers.com.51690: Flags [P.], seq 33148:33352, ack 37, win 501, length 204
03:39:31.000552 IP comp3134-winter2023.ssh > cpeac202e742173-cmac202e742170.sdns.net.rogers.com.51690: Flags [P.], seq 33352:33548, ack 37, win 501, length 196
03:39:31.000621 IP comp3134-winter2023.ssh > cpeac202e742173-cmac202e742170.sdns.net.rogers.com.51690: Flags [P.], seq 33548:33752, ack 37, win 501, length 204
03:39:31.000764 IP comp3134-winter2023.ssh > cpeac202e742173-cmac202e742170.sdns.net.rogers.com.51690: Flags [P.], seq 33752:33948, ack 37, win 501, length 196
03:39:31.000940 IP comp3134-winter2023.ssh > cpeac202e742173-cmac202e742170.sdns.net.rogers.com.51690: Flags [P.], seq 33948:34144, ack 37, win 501, length 196
03:39:31.001041 IP comp3134-winter2023.ssh > cpeac202e742173-cmac202e742170.sdns.net.rogers.com.51690: Flags [P.], seq 34144:34340, ack 37, win 501, length 196
03:39:31.001131 IP comp3134-winter2023.ssh > cpeac202e742173-cmac202e742170.sdns.net.rogers.com.51690: Flags [P.], seq 34340:34536, ack 37, win 501, length 196
03:39:31.001221 IP comp3134-winter2023.ssh > cpeac202e742173-cmac202e742170.sdns.net.rogers.com.51690: Flags [P.], seq 34536:34732, ack 37, win 501, length 196
03:39:31.001302 IP comp3134-winter2023.ssh > cpeac202e742173-cmac202e742170.sdns.net.rogers.com.51690: Flags [P.], seq 34732:34928, ack 37, win 501, length 196
03:39:31.001368 IP comp3134-winter2023.ssh > cpeac202e742173-cmac202e742170.sdns.net.rogers.com.51690: Flags [P.], seq 34928:35124, ack 37, win 501, length 196
03:39:31.001422 IP comp3134-winter2023.ssh > cpeac202e742173-cmac202e742170.sdns.net.rogers.com.51690: Flags [P.], seq 35124:35320, ack 37, win 501, length 196
03:39:31.001474 IP comp3134-winter2023.ssh > cpeac202e742173-cmac202e742170.sdns.net.rogers.com.51690: Flags [P.], seq 35320:35516, ack 37, win 501, length 196
03:39:31.002188 IP comp3134-winter2023.ssh > cpeac202e742173-cmac202e742170.sdns.net.rogers.com.51690: Flags [P.], seq 35516:35712, ack 37, win 501, length 196
03:39:31.002353 IP comp3134-winter2023.ssh > cpeac202e742173-cmac202e742170.sdns.net.rogers.com.51690: Flags [P.], seq 35712:35908, ack 37, win 501, length 196
03:39:31.002402 IP cpeac202e742173-cmac202e742170.sdns.net.rogers.com.51690 > comp3134-winter2023.ssh: Flags [.], ack 29224, win 511, length 0
03:39:31.002402 IP cpeac202e742173-cmac202e742170.sdns.net.rogers.com.51690 > comp3134-winter2023.ssh: Flags [.], ack 29440, win 510, length 0
03:39:31.002460 IP comp3134-winter2023.ssh > cpeac202e742173-cmac202e742170.sdns.net.rogers.com.51690: Flags [P.], seq 35908:36104, ack 37, win 501, length 196
03:39:31.002543 IP comp3134-winter2023.ssh > cpeac202e742173-cmac202e742170.sdns.net.rogers.com.51690: Flags [P.], seq 36104:36588, ack 37, win 501, length 484
03:39:31.002609 IP comp3134-winter2023.ssh > cpeac202e742173-cmac202e742170.sdns.net.rogers.com.51690: Flags [P.], seq 36588:36784, ack 37, win 501, length 196
03:39:31.002664 IP comp3134-winter2023.ssh > cpeac202e742173-cmac202e742170.sdns.net.rogers.com.51690: Flags [P.], seq 36784:36980, ack 37, win 501, length 196
03:39:31.002716 IP comp3134-winter2023.ssh > cpeac202e742173-cmac202e742170.sdns.net.rogers.com.51690: Flags [P.], seq 36980:37176, ack 37, win 501, length 196
03:39:31.002766 IP comp3134-winter2023.ssh > cpeac202e742173-cmac202e742170.sdns.net.rogers.com.51690: Flags [P.], seq 37176:37372, ack 37, win 501, length 196
03:39:31.003005 IP comp3134-winter2023.ssh > cpeac202e742173-cmac202e742170.sdns.net.rogers.com.51690: Flags [P.], seq 37372:37568, ack 37, win 501, length 196
03:39:31.003130 IP comp3134-winter2023.ssh > cpeac202e742173-cmac202e742170.sdns.net.rogers.com.51690: Flags [P.], seq 37568:37764, ack 37, win 501, length 196
03:39:31.003220 IP comp3134-winter2023.ssh > cpeac202e742173-cmac202e742170.sdns.net.rogers.com.51690: Flags [P.], seq 37764:37960, ack 37, win 501, length 196
03:39:31.003505 IP comp3134-winter2023.ssh > cpeac202e742173-cmac202e742170.sdns.net.rogers.com.51690: Flags [P.], seq 37960:38156, ack 37, win 501, length 196
03:39:31.003635 IP comp3134-winter2023.ssh > cpeac202e742173-cmac202e742170.sdns.net.rogers.com.51690: Flags [P.], seq 38156:38352, ack 37, win 501, length 196
03:39:31.003709 IP comp3134-winter2023.ssh > cpeac202e742173-cmac202e742170.sdns.net.rogers.com.51690: Flags [P.], seq 38352:38548, ack 37, win 501, length 196
03:39:31.004140 IP comp3134-winter2023.ssh > cpeac202e742173-cmac202e742170.sdns.net.rogers.com.51690: Flags [P.], seq 38548:38744, ack 37, win 501, length 196
03:39:31.004295 IP comp3134-winter2023.ssh > cpeac202e742173-cmac202e742170.sdns.net.rogers.com.51690: Flags [P.], seq 38744:38940, ack 37, win 501, length 196
03:39:31.004360 IP comp3134-winter2023.ssh > cpeac202e742173-cmac202e742170.sdns.net.rogers.com.51690: Flags [P.], seq 38940:39136, ack 37, win 501, length 196
03:39:31.004420 IP comp3134-winter2023.ssh > cpeac202e742173-cmac202e742170.sdns.net.rogers.com.51690: Flags [P.], seq 39136:39332, ack 37, win 501, length 196
03:39:31.004600 IP comp3134-winter2023.ssh > cpeac202e742173-cmac202e742170.sdns.net.rogers.com.51690: Flags [P.], seq 39332:39528, ack 37, win 501, length 196
03:39:31.004676 IP comp3134-winter2023.ssh > cpeac202e742173-cmac202e742170.sdns.net.rogers.com.51690: Flags [P.], seq 39528:39724, ack 37, win 501, length 196
03:39:31.013521 IP cpeac202e742173-cmac202e742170.sdns.net.rogers.com.51690 > comp3134-winter2023.ssh: Flags [.], ack 30572, win 513, length 0
03:39:31.013521 IP cpeac202e742173-cmac202e742170.sdns.net.rogers.com.51690 > comp3134-winter2023.ssh: Flags [.], ack 32208, win 513, length 0
03:39:31.013593 IP comp3134-winter2023.ssh > cpeac202e742173-cmac202e742170.sdns.net.rogers.com.51690: Flags [P.], seq 39724:39920, ack 37, win 501, length 196
03:39:31.013900 IP comp3134-winter2023.ssh > cpeac202e742173-cmac202e742170.sdns.net.rogers.com.51690: Flags [P.], seq 39920:40404, ack 37, win 501, length 484
03:39:31.014022 IP comp3134-winter2023.ssh > cpeac202e742173-cmac202e742170.sdns.net.rogers.com.51690: Flags [P.], seq 40404:40600, ack 37, win 501, length 196
03:39:31.014098 IP comp3134-winter2023.ssh > cpeac202e742173-cmac202e742170.sdns.net.rogers.com.51690: Flags [P.], seq 40600:40796, ack 37, win 501, length 196
03:39:31.014161 IP comp3134-winter2023.ssh > cpeac202e742173-cmac202e742170.sdns.net.rogers.com.51690: Flags [P.], seq 40796:40992, ack 37, win 501, length 196
03:39:31.019848 IP cpeac202e742173-cmac202e742170.sdns.net.rogers.com.51690 > comp3134-winter2023.ssh: Flags [.], ack 33352, win 508, length 0
03:39:31.019848 IP cpeac202e742173-cmac202e742170.sdns.net.rogers.com.51690 > comp3134-winter2023.ssh: Flags [.], ack 33752, win 513, length 0
03:39:31.019949 IP comp3134-winter2023.ssh > cpeac202e742173-cmac202e742170.sdns.net.rogers.com.51690: Flags [P.], seq 40992:41188, ack 37, win 501, length 196
03:39:31.020050 IP cpeac202e742173-cmac202e742170.sdns.net.rogers.com.51690 > comp3134-winter2023.ssh: Flags [.], ack 34340, win 510, length 0
03:39:31.020051 IP cpeac202e742173-cmac202e742170.sdns.net.rogers.com.51690 > comp3134-winter2023.ssh: Flags [.], ack 34536, win 510, length 0
03:39:31.020051 IP cpeac202e742173-cmac202e742170.sdns.net.rogers.com.51690 > comp3134-winter2023.ssh: Flags [.], ack 34928, win 508, length 0
03:39:31.020051 IP cpeac202e742173-cmac202e742170.sdns.net.rogers.com.51690 > comp3134-winter2023.ssh: Flags [.], ack 35320, win 513, length 0
03:39:31.020051 IP cpeac202e742173-cmac202e742170.sdns.net.rogers.com.51690 > comp3134-winter2023.ssh: Flags [.], ack 35712, win 511, length 0
03:39:31.020051 IP cpeac202e742173-cmac202e742170.sdns.net.rogers.com.51690 > comp3134-winter2023.ssh: Flags [.], ack 36104, win 510, length 0
03:39:31.020051 IP cpeac202e742173-cmac202e742170.sdns.net.rogers.com.51690 > comp3134-winter2023.ssh: Flags [.], ack 36784, win 513, length 0
03:39:31.020051 IP cpeac202e742173-cmac202e742170.sdns.net.rogers.com.51690 > comp3134-winter2023.ssh: Flags [.], ack 37176, win 511, length 0
03:39:31.020105 IP cpeac202e742173-cmac202e742170.sdns.net.rogers.com.51690 > comp3134-winter2023.ssh: Flags [.], ack 37568, win 510, length 0
03:39:31.020105 IP cpeac202e742173-cmac202e742170.sdns.net.rogers.com.51690 > comp3134-winter2023.ssh: Flags [.], ack 37960, win 508, length 0
03:39:31.020105 IP cpeac202e742173-cmac202e742170.sdns.net.rogers.com.51690 > comp3134-winter2023.ssh: Flags [.], ack 39332, win 513, length 0
03:39:31.020105 IP cpeac202e742173-cmac202e742170.sdns.net.rogers.com.51690 > comp3134-winter2023.ssh: Flags [.], ack 39724, win 511, length 0
03:39:31.020430 IP comp3134-winter2023.ssh > cpeac202e742173-cmac202e742170.sdns.net.rogers.com.51690: Flags [P.], seq 41188:43400, ack 37, win 501, length 2212
03:39:31.020760 IP comp3134-winter2023.ssh > cpeac202e742173-cmac202e742170.sdns.net.rogers.com.51690: Flags [P.], seq 43400:43596, ack 37, win 501, length 196
03:39:31.020872 IP comp3134-winter2023.ssh > cpeac202e742173-cmac202e742170.sdns.net.rogers.com.51690: Flags [P.], seq 43596:43792, ack 37, win 501, length 196
03:39:31.020965 IP comp3134-winter2023.ssh > cpeac202e742173-cmac202e742170.sdns.net.rogers.com.51690: Flags [P.], seq 43792:43988, ack 37, win 501, length 196
03:39:31.021052 IP comp3134-winter2023.ssh > cpeac202e742173-cmac202e742170.sdns.net.rogers.com.51690: Flags [P.], seq 43988:44184, ack 37, win 501, length 196
03:39:31.021140 IP comp3134-winter2023.ssh > cpeac202e742173-cmac202e742170.sdns.net.rogers.com.51690: Flags [P.], seq 44184:44380, ack 37, win 501, length 196
03:39:31.021226 IP comp3134-winter2023.ssh > cpeac202e742173-cmac202e742170.sdns.net.rogers.com.51690: Flags [P.], seq 44380:44576, ack 37, win 501, length 196
03:39:31.021313 IP comp3134-winter2023.ssh > cpeac202e742173-cmac202e742170.sdns.net.rogers.com.51690: Flags [P.], seq 44576:44772, ack 37, win 501, length 196
03:39:31.021457 IP comp3134-winter2023.ssh > cpeac202e742173-cmac202e742170.sdns.net.rogers.com.51690: Flags [P.], seq 44772:44968, ack 37, win 501, length 196
03:39:31.021554 IP comp3134-winter2023.ssh > cpeac202e742173-cmac202e742170.sdns.net.rogers.com.51690: Flags [P.], seq 44968:45164, ack 37, win 501, length 196
03:39:31.021644 IP comp3134-winter2023.ssh > cpeac202e742173-cmac202e742170.sdns.net.rogers.com.51690: Flags [P.], seq 45164:45360, ack 37, win 501, length 196
03:39:31.021738 IP comp3134-winter2023.ssh > cpeac202e742173-cmac202e742170.sdns.net.rogers.com.51690: Flags [P.], seq 45360:45556, ack 37, win 501, length 196
03:39:31.021831 IP comp3134-winter2023.ssh > cpeac202e742173-cmac202e742170.sdns.net.rogers.com.51690: Flags [P.], seq 45556:45752, ack 37, win 501, length 196
03:39:31.021930 IP comp3134-winter2023.ssh > cpeac202e742173-cmac202e742170.sdns.net.rogers.com.51690: Flags [P.], seq 45752:45948, ack 37, win 501, length 196
03:39:31.022019 IP comp3134-winter2023.ssh > cpeac202e742173-cmac202e742170.sdns.net.rogers.com.51690: Flags [P.], seq 45948:46144, ack 37, win 501, length 196
03:39:31.022274 IP comp3134-winter2023.ssh > cpeac202e742173-cmac202e742170.sdns.net.rogers.com.51690: Flags [P.], seq 46144:46340, ack 37, win 501, length 196
03:39:31.022375 IP comp3134-winter2023.ssh > cpeac202e742173-cmac202e742170.sdns.net.rogers.com.51690: Flags [P.], seq 46340:46536, ack 37, win 501, length 196
03:39:31.022467 IP comp3134-winter2023.ssh > cpeac202e742173-cmac202e742170.sdns.net.rogers.com.51690: Flags [P.], seq 46536:46732, ack 37, win 501, length 196
03:39:31.022557 IP comp3134-winter2023.ssh > cpeac202e742173-cmac202e742170.sdns.net.rogers.com.51690: Flags [P.], seq 46732:46928, ack 37, win 501, length 196
03:39:31.022660 IP comp3134-winter2023.ssh > cpeac202e742173-cmac202e742170.sdns.net.rogers.com.51690: Flags [P.], seq 46928:47124, ack 37, win 501, length 196
03:39:31.022948 IP comp3134-winter2023.ssh > cpeac202e742173-cmac202e742170.sdns.net.rogers.com.51690: Flags [P.], seq 47124:47320, ack 37, win 501, length 196
03:39:31.023102 IP comp3134-winter2023.ssh > cpeac202e742173-cmac202e742170.sdns.net.rogers.com.51690: Flags [P.], seq 47320:47516, ack 37, win 501, length 196
03:39:31.023165 IP comp3134-winter2023.ssh > cpeac202e742173-cmac202e742170.sdns.net.rogers.com.51690: Flags [P.], seq 47516:47712, ack 37, win 501, length 196
03:39:31.023405 IP comp3134-winter2023.ssh > cpeac202e742173-cmac202e742170.sdns.net.rogers.com.51690: Flags [P.], seq 47712:47908, ack 37, win 501, length 196
03:39:31.023482 IP comp3134-winter2023.ssh > cpeac202e742173-cmac202e742170.sdns.net.rogers.com.51690: Flags [P.], seq 47908:48104, ack 37, win 501, length 196
03:39:31.023537 IP comp3134-winter2023.ssh > cpeac202e742173-cmac202e742170.sdns.net.rogers.com.51690: Flags [P.], seq 48104:48300, ack 37, win 501, length 196
03:39:31.023590 IP comp3134-winter2023.ssh > cpeac202e742173-cmac202e742170.sdns.net.rogers.com.51690: Flags [P.], seq 48300:48496, ack 37, win 501, length 196
03:39:31.023642 IP comp3134-winter2023.ssh > cpeac202e742173-cmac202e742170.sdns.net.rogers.com.51690: Flags [P.], seq 48496:48692, ack 37, win 501, length 196
03:39:31.023818 IP comp3134-winter2023.ssh > cpeac202e742173-cmac202e742170.sdns.net.rogers.com.51690: Flags [P.], seq 48692:48888, ack 37, win 501, length 196
03:39:31.023983 IP comp3134-winter2023.ssh > cpeac202e742173-cmac202e742170.sdns.net.rogers.com.51690: Flags [P.], seq 48888:49084, ack 37, win 501, length 196
03:39:31.024043 IP comp3134-winter2023.ssh > cpeac202e742173-cmac202e742170.sdns.net.rogers.com.51690: Flags [P.], seq 49084:49280, ack 37, win 501, length 196
03:39:31.024093 IP comp3134-winter2023.ssh > cpeac202e742173-cmac202e742170.sdns.net.rogers.com.51690: Flags [P.], seq 49280:49476, ack 37, win 501, length 196
03:39:31.026033 IP cpeac202e742173-cmac202e742170.sdns.net.rogers.com.51690 > comp3134-winter2023.ssh: Flags [.], ack 39920, win 510, length 0
03:39:31.026034 IP cpeac202e742173-cmac202e742170.sdns.net.rogers.com.51690 > comp3134-winter2023.ssh: Flags [.], ack 40992, win 513, length 0
03:39:31.026103 IP comp3134-winter2023.ssh > cpeac202e742173-cmac202e742170.sdns.net.rogers.com.51690: Flags [P.], seq 49476:49672, ack 37, win 501, length 196
03:39:31.026337 IP comp3134-winter2023.ssh > cpeac202e742173-cmac202e742170.sdns.net.rogers.com.51690: Flags [P.], seq 49672:50156, ack 37, win 501, length 484
03:39:31.026408 IP comp3134-winter2023.ssh > cpeac202e742173-cmac202e742170.sdns.net.rogers.com.51690: Flags [P.], seq 50156:50352, ack 37, win 501, length 196
03:39:31.026459 IP comp3134-winter2023.ssh > cpeac202e742173-cmac202e742170.sdns.net.rogers.com.51690: Flags [P.], seq 50352:50548, ack 37, win 501, length 196
03:39:31.026507 IP comp3134-winter2023.ssh > cpeac202e742173-cmac202e742170.sdns.net.rogers.com.51690: Flags [P.], seq 50548:50744, ack 37, win 501, length 196
03:39:31.026693 IP comp3134-winter2023.ssh > cpeac202e742173-cmac202e742170.sdns.net.rogers.com.51690: Flags [P.], seq 50744:50940, ack 37, win 501, length 196
03:39:31.031628 IP cpeac202e742173-cmac202e742170.sdns.net.rogers.com.51690 > comp3134-winter2023.ssh: Flags [.], ack 42648, win 513, length 0
03:39:31.031628 IP cpeac202e742173-cmac202e742170.sdns.net.rogers.com.51690 > comp3134-winter2023.ssh: Flags [.], ack 46144, win 513, length 0
03:39:31.031691 IP comp3134-winter2023.ssh > cpeac202e742173-cmac202e742170.sdns.net.rogers.com.51690: Flags [P.], seq 50940:51136, ack 37, win 501, length 196
03:39:31.031976 IP comp3134-winter2023.ssh > cpeac202e742173-cmac202e742170.sdns.net.rogers.com.51690: Flags [P.], seq 51136:51620, ack 37, win 501, length 484
